{
    "$schema": "https://json-schema.org/draft/2020-12/schema",
    "$id": "https://etapsky.github.io/sdf/schemas/gov-tax-declaration/v0.1.json",
    "title": "SDF Government Tax Declaration",
    "description": "Schema for SDF corporate tax declaration documents. Version: 0.1.",
    "type": "object",
    "required": ["document_type", "declaration_type", "tax_year", "period", "declaration_date", "taxpayer", "tax_authority", "financials"],
    "properties": {
      "document_type":     { "type": "string", "const": "gov_tax_declaration" },
      "declaration_type":  { "type": "string", "enum": ["corporate_income_tax", "vat_annual", "vat_quarterly", "withholding_tax"] },
      "tax_year":          { "type": "string", "pattern": "^\\d{4}$" },
      "period":            { "type": "string", "description": "ISO 8601 date range. E.g. '2025-01-01/2025-12-31'." },
      "declaration_date":  { "type": "string", "format": "date" },
      "declaration_ref":   { "type": "string", "description": "Reference number assigned by the tax authority." },
      "taxpayer":          { "$ref": "#/$defs/taxpayer" },
      "tax_authority":     { "$ref": "#/$defs/authority" },
      "financials":        { "$ref": "#/$defs/financials" },
      "preparer":          { "$ref": "#/$defs/preparer" }
    },
    "additionalProperties": false,
    "$defs": {
      "monetary_amount": {
        "type": "object",
        "required": ["amount", "currency"],
        "properties": {
          "amount":   { "type": "string", "pattern": "^\\d+(\\.\\d{1,4})?$" },
          "currency": { "type": "string", "pattern": "^[A-Z]{3}$" }
        },
        "additionalProperties": false
      },
      "address": {
        "type": "object",
        "required": ["street", "city", "country"],
        "properties": {
          "street":      { "type": "string" },
          "city":        { "type": "string" },
          "postal_code": { "type": "string" },
          "country":     { "type": "string", "pattern": "^[A-Z]{2}$" }
        },
        "additionalProperties": false
      },
      "contact": {
        "type": "object",
        "properties": {
          "name":  { "type": "string" },
          "email": { "type": "string", "format": "email" },
          "phone": { "type": "string" }
        },
        "additionalProperties": false
      },
      "taxpayer": {
        "type": "object",
        "required": ["name", "id"],
        "properties": {
          "name":       { "type": "string" },
          "id":         { "type": "string", "description": "Tax identification number or company registration number." },
          "legal_form": { "type": "string" },
          "address":    { "$ref": "#/$defs/address" },
          "contact":    { "$ref": "#/$defs/contact" }
        },
        "additionalProperties": false
      },
      "authority": {
        "type": "object",
        "required": ["name"],
        "properties": {
          "name":    { "type": "string" },
          "id":      { "type": "string" },
          "address": { "$ref": "#/$defs/address" }
        },
        "additionalProperties": false
      },
      "financials": {
        "type": "object",
        "required": ["taxable_income", "tax_rate", "tax_due"],
        "properties": {
          "revenue":            { "$ref": "#/$defs/monetary_amount" },
          "cost_of_goods":      { "$ref": "#/$defs/monetary_amount" },
          "gross_profit":       { "$ref": "#/$defs/monetary_amount" },
          "operating_expenses": { "$ref": "#/$defs/monetary_amount" },
          "operating_income":   { "$ref": "#/$defs/monetary_amount" },
          "taxable_income":     { "$ref": "#/$defs/monetary_amount" },
          "tax_rate":           { "type": "string", "pattern": "^0(\\.\\d+)?$", "description": "Decimal string. E.g. '0.1485' = 14.85%." },
          "tax_due":            { "$ref": "#/$defs/monetary_amount" },
          "tax_prepaid":        { "$ref": "#/$defs/monetary_amount" },
          "tax_balance":        { "$ref": "#/$defs/monetary_amount" }
        },
        "additionalProperties": false
      },
      "preparer": {
        "type": "object",
        "required": ["name"],
        "properties": {
          "name":    { "type": "string" },
          "id":      { "type": "string" },
          "contact": { "$ref": "#/$defs/contact" }
        },
        "additionalProperties": false
      }
    }
  }