{
    "document_type": "gov_tax_declaration",
    "declaration_type": "corporate_income_tax",
    "tax_year": "2025",
    "period": "2025-01-01/2025-12-31",
    "declaration_date": "2026-03-31",
    "taxpayer": {
      "name": "Global Logistics AG",
      "id": "CHE-123.456.789",
      "legal_form": "AG",
      "address": {
        "street": "Bahnhofstrasse 4",
        "city": "Zürich",
        "postal_code": "8001",
        "country": "CH"
      },
      "contact": {
        "name": "Thomas Meier",
        "email": "t.meier@global-logistics.ch",
        "phone": "+41 44 000 0000"
      }
    },
    "tax_authority": {
      "name": "Swiss Federal Tax Administration",
      "id": "CHE-SFTA",
      "address": {
        "street": "Eigerstrasse 65",
        "city": "Bern",
        "postal_code": "3003",
        "country": "CH"
      }
    },
    "financials": {
      "revenue":          { "amount": "12500000.00", "currency": "CHF" },
      "cost_of_goods":    { "amount": "8200000.00",  "currency": "CHF" },
      "gross_profit":     { "amount": "4300000.00",  "currency": "CHF" },
      "operating_expenses": { "amount": "2100000.00", "currency": "CHF" },
      "operating_income": { "amount": "2200000.00",  "currency": "CHF" },
      "taxable_income":   { "amount": "2200000.00",  "currency": "CHF" },
      "tax_rate":         "0.1485",
      "tax_due":          { "amount": "326700.00",   "currency": "CHF" },
      "tax_prepaid":      { "amount": "300000.00",   "currency": "CHF" },
      "tax_balance":      { "amount": "26700.00",    "currency": "CHF" }
    },
    "preparer": {
      "name": "Zürich Tax Advisors AG",
      "id": "CHE-999.888.777",
      "contact": {
        "name": "Dr. Anna Schweizer",
        "email": "a.schweizer@zta.ch"
      }
    },
    "declaration_ref": "SFTA-2026-GL-00842"
  }